{
  "author_model": "gemini-3.8-flash",
  "counts": {
    "blocking": 0,
    "informational": 2,
    "non_blocking": 3
  },
  "findings": [
    {
      "description": "Cloud design stages cannot execute unattended in CI due to interactive personal subscription requirements, necessitating a split workflow where developers run cloud stages locally and transfer state to CI.",
      "id": "critique-f1-unattended-ci-split",
      "severity": "non_blocking",
      "subject": "subscription_conflict_statement"
    },
    {
      "description": "Exporting run state containing confidential source trees and protected tests to CI artifact storage (Jenkins stashes or GitLab job artifacts) introduces risk of confidential data leakage if the adopter uses shared or cloud-backed CI runners.",
      "id": "critique-f2-ci-confidential-storage",
      "severity": "non_blocking",
      "subject": "ci_adapter_jenkins_gitlab"
    },
    {
      "description": "Connecting guest VM or WSL2 sandboxes to host-managed local models (Ollama, llama-server) over a virtual network bridge complicates egress verification compared to single-kernel Linux bwrap loopback setups.",
      "id": "critique-f3-vm-network-isolation",
      "severity": "non_blocking",
      "subject": "os_portability_matrix"
    },
    {
      "description": "Refusing model dispatching stages natively on Windows and macOS preserves isolation guarantees but requires developers on those platforms to manage external virtualization prerequisites (WSL2, Lima, UTM) outside the uv distribution.",
      "id": "critique-f4-external-vm-prerequisite",
      "severity": "informational",
      "subject": "isolation_backend_layer"
    },
    {
      "description": "Adopting repositories must keep .agentic/pipeline.lock synchronized with agentic-pipeline package versions during upgrades to prevent runtime failures from lock-hash drift.",
      "id": "critique-f5-lockfile-synchronization",
      "severity": "informational",
      "subject": "adoption_model"
    }
  ],
  "id": "A2-critique-a-by-b",
  "manifest_hash": "sha256:bf3ad158b67b0c0061c0e2c1409071cb96f27b743b727bcd533838b8ab79129f",
  "review_complete": true,
  "scores": {
    "cost": {
      "evidence": "The design uses existing personal subscriptions and local models without adding API keys, paid endpoints, or paid third-party dependencies.",
      "score": 4
    },
    "maintainability": {
      "evidence": "The package depends exclusively on the Python standard library with no new third-party dependencies, preserving run formats and pinning defaults via .agentic/pipeline.lock.",
      "score": 4
    },
    "reliability": {
      "evidence": "CI job chaining enforces integrity through sha256 manifests, sealed input verification, and frozen digest checks at each state import.",
      "score": 3
    },
    "scalability": {
      "evidence": "Inability to run cloud stages unattended in CI forces a hybrid local-to-CI handoff, restricting automated throughput and scaling.",
      "score": 2
    },
    "security": {
      "evidence": "Bwrap isolation is preserved across platforms by refusing model stages on native Windows/macOS, vendor OAuth tokens are isolated in tmpfs sandboxes, and offline human signatures are bound to the log tip.",
      "score": 3
    }
  },
  "target_proposal_id": "A1-proposal-a-pkg-overlay"
}