{
  "author_model": "gemini-3.8-flash",
  "counts": {
    "blocking": 0,
    "informational": 2,
    "non_blocking": 1
  },
  "findings": [
    {
      "description": "The proposal details the export and import verification of run state via 'ci export-state' and 'ci import-state', but does not specify how the exported state archive is ingested or authenticated when transferred from a developer workstation to internal CI storage in the split cloud/CI execution model.",
      "id": "finding-ci-state-ingest",
      "severity": "non_blocking",
      "subject": "ci_adapter_jenkins_gitlab"
    },
    {
      "description": "Native Windows and macOS platforms reject model-dispatching stages by design to uphold sandbox isolation, requiring developers on these platforms to install and maintain WSL2 or a Linux VM (Lima/UTM) with bwrap to run model stages.",
      "id": "finding-host-virtualization-dependency",
      "severity": "informational",
      "subject": "os_portability_matrix"
    },
    {
      "description": "The config TUI outputs proposals and diffs to '.runs/config-proposals/' and explicitly avoids executing git commands, necessitating manual human copying and committing into the repository policy tree under reviewed change.",
      "id": "finding-config-tui-manual-commit",
      "severity": "informational",
      "subject": "config_tui"
    }
  ],
  "id": "critique-A3-synthesis-s-pkg-overlay",
  "manifest_hash": "sha256:bf3ad158b67b0c0061c0e2c1409071cb96f27b743b727bcd533838b8ab79129f",
  "review_complete": true,
  "scores": {
    "cost": {
      "evidence": "Forbids paid API keys and usage-credit endpoints, relying on personal interactive developer CLI subscriptions for cloud design stages and local model runtimes for build stages.",
      "score": 4
    },
    "maintainability": {
      "evidence": "Zero third-party runtime dependencies using Python standard library only; uv tool packaging; configuration resolved from git trees at commit SHA; structured error taxonomy emitted as JSON lines.",
      "score": 4
    },
    "reliability": {
      "evidence": "State integrity is validated on import via sha256 manifests and hash chains; concurrency locks and idempotency keys (run_id, stage, input digest) prevent duplicate execution; expired state fails closed.",
      "score": 4
    },
    "scalability": {
      "evidence": "CI jobs are split and serialized per run ID using resource groups or Jenkins lock, though model execution remains constrained to bwrap-capable Linux hosts.",
      "score": 3
    },
    "security": {
      "evidence": "Confidential source tree and protected tests never reach cloud services; isolation probes verify mount, egress denial, and credential visibility per run; approvals require offline human signatures via ssh-keygen -Y bound to evidence digests.",
      "score": 4
    }
  },
  "target_proposal_id": "A3-synthesis-s-pkg-overlay"
}